{
  "architectures": [
    {
      "collection_state": "complete",
      "declarations": [
        {
          "key": "com.apple.private.entitlementlens-curated.unknown",
          "value": {
            "boolean": false,
            "type": "boolean"
          }
        },
        {
          "key": "com.apple.security.App-sandbox",
          "value": {
            "string": "case differs",
            "type": "string"
          }
        },
        {
          "key": "com.apple.security.app-sandbox",
          "value": {
            "boolean": true,
            "type": "boolean"
          }
        },
        {
          "key": "com.apple.security.get-task-allow",
          "value": {
            "string": "false",
            "type": "string"
          }
        }
      ],
      "name": "x86_64",
      "signature_integrity": "valid"
    },
    {
      "collection_state": "complete",
      "declarations": [
        {
          "key": "com.apple.private.entitlementlens-curated.unknown",
          "value": {
            "boolean": false,
            "type": "boolean"
          }
        },
        {
          "key": "com.apple.security.App-sandbox",
          "value": {
            "string": "case differs",
            "type": "string"
          }
        },
        {
          "key": "com.apple.security.app-sandbox",
          "value": {
            "boolean": true,
            "type": "boolean"
          }
        },
        {
          "key": "com.apple.security.get-task-allow",
          "value": {
            "boolean": false,
            "type": "boolean"
          }
        }
      ],
      "name": "arm64",
      "signature_integrity": "valid"
    }
  ],
  "artifact_label": "curated-universal-fixture",
  "artifact_sha256": "de3c3b63027c0609eb8cdc9b00f36fafccd322ecb4733ec83c5b45ec528995f0",
  "case_id": "curated-universal-fixture",
  "collector": {
    "collected_at_utc": "2026-10-17T18:47:25Z",
    "feature_schema_version": 3,
    "host_macos_build": "26A428",
    "host_macos_version": "27.0",
    "name": "EntitlementLens",
    "source_commit": "a29639fe853c948adc05d649ed6960a487822aee"
  },
  "entitlement_collection_state": "complete",
  "evidence_scope": "static_signed_declarations",
  "runtime_authorization": "not_assessed",
  "sample_kind": "controlled_fixture",
  "schema_version": 1,
  "signature_integrity": "valid",
  "source_reference": "EntitlementExplanationIntegrationTests.curatedSelectionRetainsSignedArchitectureDeclarationsAndExportBytes"
}
